{
  "schema_version": 1,
  "handoff_id": "AIC-0016-0001",
  "task_id": "AIC-0016",
  "sequence": 1,
  "from_agent": "claude",
  "to_agent": "human",
  "kind": "review",
  "created_at": "2026-09-22T20:56:46Z",
  "branch": "claude/AIC-0016-review",
  "base_commit": "4827f47db533883e7b9607832583a5dfc0e1d05e",
  "delivery_commit": "5cc5f2b7847d8fbff4683a60bade0e5ac788f2e3",
  "summary": "Revisao de 5cc5f2b (AIC-0008): ACEITAR. CI do GitHub Actions e o validador independente de schema (jsonschema) fazem exatamente o que a tarefa pediu, confirmado por execucao real, inclusive com um teste quebrado de proposito.",
  "changes": [
    {
      "path": "-",
      "what": "nenhuma alteracao: revisao somente leitura em worktree isolado (git worktree add --detach no commit revisado), sem tocar wt-codex nem wt-claude alem desta branch"
    }
  ],
  "tests": [
    {
      "command": "verificacao de escopo: git diff --name-only 4827f47..5cc5f2b so toca .github/workflows/ci.yml, tests/test_schema_conformance.py, README.md; handoff (5cc5f2b..d6bdc6e) so toca .ai/handoffs/AIC-0008/0001-codex.json",
      "result": "pass",
      "note": "nenhum forbidden_path tocado"
    },
    {
      "command": "git log 4827f47..d6bdc6e --format='%an <%ae>' e checagem de trailers de coautoria",
      "result": "pass",
      "note": "autoria LuKas <Lukelucanolightknowledge@gmail.com> nos 2 commits; 0 trailers de coautoria"
    },
    {
      "command": "python3 scripts/validate-handoff.py .ai/handoffs/AIC-0008/0001-codex.json",
      "result": "pass",
      "note": "VALIDO, exit 0"
    },
    {
      "command": "bash tests/test_handoff.sh em 5cc5f2b",
      "result": "pass",
      "note": "69/69"
    },
    {
      "command": "bash tests/test_skills.sh e tests/test_doctor.sh em 5cc5f2b",
      "result": "pass",
      "note": "44/44 e codigos 0-4 verificados"
    },
    {
      "command": "python3 tests/test_schema_conformance.py em clone limpo, com jsonschema instalado (pip install --user jsonschema, nao vinha pre-instalado no ambiente de revisao)",
      "result": "pass",
      "note": "valida .ai/examples/ e .ai/handoffs/**/*.json contra handoff.schema.json, e .ai/tasks/*.json contra task.schema.json, usando a biblioteca jsonschema de verdade"
    },
    {
      "command": "mutante: corromper schema_version=99 em .ai/examples/AIC-0001-0001-claude.delivery.json e rerodar test_schema_conformance.py",
      "result": "pass",
      "note": "falhou com exit 1 apontando o arquivo corrompido, confirmando que o validador pega drift de verdade; arquivo restaurado depois, git status limpo"
    },
    {
      "command": "reproducao local exata dos comandos do workflow .github/workflows/ci.yml, uma vez limpa e uma vez com um teste quebrado de proposito",
      "result": "pass",
      "note": "verde na versao limpa, vermelho (exit != 0) na versao quebrada; exatamente a prova que a tarefa exigiu do Codex"
    },
    {
      "command": "leitura do workflow: permissions contents:read, sem segredos, nunca pull_request_target, git user.name/user.email configurados no job, python3+jsonschema instalados, badge no README.md",
      "result": "pass",
      "note": "todos os criterios de aceite de texto conferidos linha a linha"
    }
  ],
  "risks": [
    "Prova real do lado do GitHub (job verde de verdade, e vermelho numa branch quebrada de proposito) continua sendo passo do coordenador: esta revisao, como o proprio handoff do Codex, so reproduziu os comandos do workflow localmente.",
    "As duas actions em ci.yml estao pinadas por SHA completo como exigido, mas esta revisao nao teve acesso a rede para confirmar que esses SHAs realmente correspondem as tags comentadas (actions/checkout, actions/setup-python); vale um spot-check de quem tiver acesso ao GitHub antes ou ao empurrar a branch.",
    "tests/test_schema_conformance.py e uma segunda implementacao independente da mesma validacao que scripts/validate-handoff.py e os schemas ja fazem — e o objetivo declarado da tarefa (fechar o risco 'schema e validador sao duas implementacoes'), nao um defeito."
  ],
  "findings": [
    {
      "severity": "low",
      "path": ".github/workflows/ci.yml",
      "line": null,
      "finding": "As actions estao pinadas por SHA completo (correto), mas o SHA de actions/checkout e actions/setup-python nao pode ser confirmado offline contra as tags v4.2.2/v5.6.0 comentadas ao lado. Nao e um erro encontrado, e uma checagem que falta e que exige rede."
    }
  ],
  "next_action": "Nenhuma correcao pendente do Codex. Coordenador: empurrar codex/AIC-0008-ci, confirmar um job verde de verdade e um vermelho numa branch quebrada de proposito, conferir os 2 SHAs de actions pinadas, e so entao mergear.",
  "previous_handoff": null
}
