{
  "schema_version": 1,
  "handoff_id": "AIC-0001-0001",
  "task_id": "AIC-0001",
  "sequence": 1,
  "from_agent": "claude",
  "to_agent": "codex",
  "kind": "delivery",
  "created_at": "2026-09-21T14:05:00Z",
  "branch": "claude/AIC-0001-protocolo",
  "base_commit": "bdef1a7a0f2e1b760ca490fb14e8eda2434ec7db",
  "delivery_commit": "0000000000000000000000000000000000000000",
  "summary": "Substitui o gerador inseguro por criacao de handoff validada e atomica.",
  "changes": [
    {"path": "scripts/handoff.sh", "what": "allowlist de TASK_ID e criacao via ln(2)"},
    {"path": "scripts/validate-handoff.py", "what": "validador do contrato, sem dependencia externa"}
  ],
  "tests": [
    {"command": "tests/test_handoff.sh", "result": "pass", "note": "40 casos, inclui 8 criacoes simultaneas"}
  ],
  "risks": [
    "O validador e escrito a mao contra este schema; schema e validador precisam mudar juntos."
  ],
  "next_action": "Revisar o commit entregue quanto a escape de caminho, atomicidade e cobertura do teste.",
  "previous_handoff": null
}
