{
  "schema_version": 1,
  "handoff_id": "AIC-0001-0004",
  "task_id": "AIC-0001",
  "sequence": 4,
  "from_agent": "codex",
  "to_agent": "human",
  "kind": "review",
  "created_at": "2026-09-21T21:54:19Z",
  "branch": "codex/AIC-0002-operacional",
  "base_commit": "bdef1a7a0f2e1b760ca490fb14e8eda2434ec7db",
  "delivery_commit": "f01adf6bcf5acafecc9a0548c15ff42fdbeb467a",
  "summary": "Transcricao fiel, feita pelo Claude a pedido do coordenador humano, da re-revisao do Codex sobre f01adf6. Veredito: ACEITAR_COM_RESSALVAS. O Codex reportou em texto; este arquivo preserva a cadeia.",
  "changes": [
    {
      "path": "-",
      "what": "nenhuma alteracao: revisao somente leitura em copias temporarias, sem checkout nem edicao de wt-claude"
    }
  ],
  "tests": [
    {
      "command": "reproducao: .ai como symlink",
      "result": "pass",
      "note": "recusado; nada escrito fora do repositorio"
    },
    {
      "command": "reproducao: aspas no nome da branch",
      "result": "pass",
      "note": "JSON valido, nome preservado"
    },
    {
      "command": "reproducao: campos <TODO> e not_run sem justificativa",
      "result": "pass",
      "note": "ambos recusados pelo validador"
    },
    {
      "command": "teste de concorrencia",
      "result": "pass",
      "note": "verifica sequencia contigua, sem repeticao e cadeia integra"
    },
    {
      "command": "reproducao: findings em handoff de entrega",
      "result": "pass",
      "note": "recusado pelo validador; o schema contem a proibicao"
    },
    {
      "command": "reproducao: sequencia entre agentes com barreira forcando a corrida",
      "result": "pass",
      "note": "commit antigo criou dois arquivos de sequencia 1; f01adf6 teve um sucesso e uma recusa pelo lock"
    },
    {
      "command": "bash tests/test_handoff.sh em f01adf6",
      "result": "pass",
      "note": "55/55"
    },
    {
      "command": "validate-handoff.py nos tres handoffs da rodada, com multiplos arquivos",
      "result": "pass"
    }
  ],
  "risks": [
    "O Codex nao executou um validador JSON Schema independente: conferiu as regras alteradas no schema e exercitou o validador do projeto."
  ],
  "findings": [
    {
      "severity": "low",
      "path": ".ai/handoffs/AIC-0001/0003-claude.json",
      "line": null,
      "finding": "O next_action cita 01730e8, embora delivery_commit e esta revisao apontem para f01adf6. O commit correto e f01adf6. Handoff publicado e imutavel: fica registrado aqui, nao corrigido la."
    },
    {
      "severity": "low",
      "path": "metadados dos commits 01730e8 e f01adf6",
      "line": null,
      "finding": "Autor registrado como Lukas Ceratti Agnese <lukelucanolightknowledge@gmail.com>, diferente da identidade exata LuKas <Lukelucanolightknowledge@gmail.com> pedida nas instrucoes. Vem do ~/.gitconfig global."
    },
    {
      "severity": "low",
      "path": "scripts/handoff.sh",
      "line": null,
      "finding": "Lock abandonado apos kill -9 exige rmdir manual. Limite declarado na SPEC, sem expiracao automatica no MVP."
    }
  ],
  "next_action": "Lukas decide o aceite de AIC-0001 e faz o merge, tratando as tres ressalvas; a de autoria depende de reescrever ou nao os commits (muda o hash de f01adf6).",
  "previous_handoff": "0003-claude.json"
}
