{
  "schema_version": 1,
  "handoff_id": "AIC-0012-0001",
  "task_id": "AIC-0012",
  "sequence": 1,
  "from_agent": "codex",
  "to_agent": "human",
  "kind": "delivery",
  "created_at": "2026-09-22T00:04:06Z",
  "branch": "codex/AIC-0012-spec-licoes",
  "base_commit": "4827f47db533883e7b9607832583a5dfc0e1d05e",
  "delivery_commit": "1c55400075f15780e3c3c80605eef16af2974299",
  "summary": "SPEC e guia registram sequencia por branch, revisao propria e merge humano.",
  "changes": [
    {"path": "docs/SPEC-v0.1.md", "what": "Documenta sequencia por branch, tarefas proprias de revisao, limite do lock morto e motivacao para merge humano."},
    {"path": "docs/AI-HANDOFF.md", "what": "Exige REVIEWED_COMMIT igual ao delivery_commit recebido e declara que o vinculo ainda nao e imposto mecanicamente."}
  ],
  "tests": [
    {"command": "bash tests/test_handoff.sh", "result": "pass"},
    {"command": "bash tests/test_skills.sh", "result": "pass"},
    {"command": "bash tests/test_doctor.sh", "result": "pass"}
  ],
  "risks": ["O vinculo entre REVIEWED_COMMIT e o handoff recebido permanece procedimental; validar automaticamente exigiria expandir o contrato com a origem do handoff."],
  "next_action": "O coordenador deve revisar o handoff e decidir o merge; não houve revisão independente do Claude.",
  "previous_handoff": null
}
