{
  "schema_version": 1,
  "handoff_id": "AIC-0006-0002",
  "task_id": "AIC-0006",
  "sequence": 2,
  "from_agent": "codex",
  "to_agent": "human",
  "kind": "correction",
  "created_at": "2026-09-21T22:57:48Z",
  "branch": "codex/AIC-0006-review-arg",
  "base_commit": "cf71f31aaf509330ea4d945442bbfed43d23457c",
  "delivery_commit": "dabd3252f9fe87a067eb4de6cfba8838461c263a",
  "summary": "Corrigidos os dois achados da AIC-0007: o teste agora protege a base de review em outro ramo e a falha sem ancestral comum tem mensagem correta.",
  "changes": [
    {"path": "tests/test_handoff.sh", "what": "Cria um commit revisado em outro ramo, afirma delivery_commit e merge-base independentes, e cobre commit sem ancestral comum."},
    {"path": "scripts/handoff.sh", "what": "Distingue main ausente de ausencia de ancestral comum ao derivar base_commit."},
    {"path": "docs/SPEC-v0.1.md", "what": "Atualiza de 65 para 69 o total declarado da suite de handoff."}
  ],
  "tests": [
    {"command": "bash tests/test_handoff.sh", "result": "pass", "note": "69 passaram, 0 falharam."},
    {"command": "mutante temporario: base_commit = delivery_commit somente em review; bash tests/test_handoff.sh", "result": "fail", "note": "65 passaram, 4 falharam; o novo caso de outro ramo falhou, provando que rejeita o mutante."},
    {"command": "bash tests/test_skills.sh", "result": "pass", "note": "44 passaram, 0 falharam."},
    {"command": "bash tests/test_doctor.sh", "result": "pass", "note": "Codigos de saida 0, 1, 2, 3 e 4 verificados."},
    {"command": "git diff --check", "result": "pass"}
  ],
  "risks": [],
  "next_action": "Coordenador: faca o merge autorizado de codex/AIC-0006-review-arg e claude/AIC-0007-review; nao houve merge nem push nesta correcao.",
  "previous_handoff": "0001-codex.json"
}
