{
  "schema_version": 1,
  "handoff_id": "AIC-0015-0001",
  "task_id": "AIC-0015",
  "sequence": 1,
  "from_agent": "claude",
  "to_agent": "human",
  "kind": "review",
  "created_at": "2026-09-22T21:02:24Z",
  "branch": "claude/AIC-0015-review",
  "base_commit": "4827f47db533883e7b9607832583a5dfc0e1d05e",
  "delivery_commit": "1d8da9bb177fa2bbca47b20ed5d90a04500ce4aa",
  "summary": "Revisao de 1d8da9b (AIC-0014): ACEITAR. scripts/validate-task.py valida schema, transicoes legais e escopos disjuntos de .ai/tasks/*.json sem nenhuma dependencia externa, confirmado por execucao real contra os JSONs reais do repositorio.",
  "changes": [
    {
      "path": "-",
      "what": "nenhuma alteracao: revisao somente leitura em worktree isolado (git worktree add --detach no commit revisado), sem tocar wt-codex nem wt-claude alem desta branch"
    }
  ],
  "tests": [
    {
      "command": "verificacao de escopo: git diff --name-only 4827f47..1d8da9b toca exatamente scripts/validate-task.py e tests/test_task.sh",
      "result": "pass",
      "note": "nenhum forbidden_path tocado (.ai/tasks/, .ai/schemas/, .ai/examples/, scripts/handoff.sh, scripts/validate-handoff.py, scripts/ai-coop-doctor.sh, docs/, .github/, SECURITY.md, LICENSE, CONTRIBUTING.md, .claude/, .agents/ intactos)"
    },
    {
      "command": "git log 4827f47..0b752f2 --format='%an <%ae>' e checagem de trailers de coautoria",
      "result": "pass",
      "note": "autoria LuKas <Lukelucanolightknowledge@gmail.com> nos 2 commits (1d8da9b, 0b752f2); 0 trailers de coautoria"
    },
    {
      "command": "python3 scripts/validate-handoff.py .ai/handoffs/AIC-0014/0001-codex.json",
      "result": "pass",
      "note": "VALIDO, exit 0"
    },
    {
      "command": "grep de imports em scripts/validate-task.py",
      "result": "pass",
      "note": "so json, re, sys, datetime, pathlib (stdlib); nenhuma dependencia externa, como a tarefa exigia (ao contrario do validador de schema independente da AIC-0008, que usa jsonschema de proposito)"
    },
    {
      "command": "bash tests/test_task.sh em worktree isolado",
      "result": "pass",
      "note": "23/23: transicoes legais e ilegais de estado (tabela da SPEC secao 2), schema invalido falha com campos ausentes listados, escopos sobrepostos com donos distintos falham (inclusive por prefixo de diretorio, ex. scripts vs scripts/tool.py), escopos distintos e mesmo dono passam, tarefa terminal/aceita nao bloqueia escopo"
    },
    {
      "command": "python3 scripts/validate-task.py <cada .ai/tasks/*.json real do commit 1d8da9b>",
      "result": "pass",
      "note": "todos os 14 arquivos de tarefa reais passam no validador; nenhum achado de tarefa invalida no repositorio"
    },
    {
      "command": "bash tests/test_handoff.sh, tests/test_skills.sh, tests/test_doctor.sh em 1d8da9b",
      "result": "pass",
      "note": "69/69, 44/44, codigos 0-4 verificados"
    }
  ],
  "risks": [
    "Validador de tarefa e uma segunda fonte de verdade sobre estados/escopos, paralela a leitura humana e ao futuro CI (AIC-0008); util para pegar drift cedo, mas exige ser chamado (nao roda sozinho salvo se o CI da AIC-0008 vier a invoca-lo tambem, o que nao faz parte desta tarefa)."
  ],
  "findings": [],
  "next_action": "Nenhuma correcao necessaria. Coordenador pode mergear codex/AIC-0014-task-validator quando quiser; e independente das outras 5 entregas. Nota lateral (nao bloqueante): a primeira tentativa de revisao desta tarefa (um fork em background) desviou para um relatorio de status geral da rodada em vez do proprio veredito, mesmo apos pedido de reenvio — resolvido refazendo a revisao diretamente, sem impacto no veredito.",
  "previous_handoff": null
}
